{
  "claim_boundary": "Image references and attestation metadata are shape-validated locally; registry signatures and deployment binding require external verification.",
  "generated_at_utc": "2026-09-07T13:25:14Z",
  "images": {
    "AURUM_API_IMAGE": null,
    "AURUM_DASHBOARD_IMAGE": null,
    "AURUM_REDIS_IMAGE": null,
    "AURUM_TIMESCALE_IMAGE": null
  },
  "manifest_path": "config/production_image_provenance.json",
  "manifest_present": false,
  "manifest_schema_valid": false,
  "metadata_checks": {
    "all_images_pinned_by_sha256": false,
    "deployment_binding_present": false,
    "required_attestation_metadata": false
  },
  "schema_version": "1.0",
  "service": "AURUM production image provenance intake",
  "source": "REPOSITORY",
  "status": "REQUIRED"
}
